quality;grade;descriptor
Diplomacy;A;A skillful negotiator, who instinctively reads a situation correctly, understands the motivations and feelings of the other party, and chooses the right time to proceed or withdraw.
Diplomacy;B;A good negotiator, who usually chooses the right time to proceed or withdraw in a negotiation after reading the situation correctly. But not yet infallible and may need more experience.
Diplomacy;C;In negotiations, is generally aware of the motivations and feelings of the other party, but prone to an occasional blunder, which has prevented a successful outcome and may have soured a relationship.
Diplomacy;D;Not sufficiently aware of the motivations and feelings of others, and this has frequently caused negotiations to break down.
Diplomacy;E;Constantly ignores the motivations and feelings of others, and is totally unsuited for sensitive negotiations.
Discretion;A;Understands the importance of confidentiality, and can always be trusted not to reveal confidential or private information to unauthorized parties.
Discretion;B;Has proved to be trustworthy, but has not yet been given access to material of a highly confidential or sensitive nature. 
Discretion;C;Is somewhat casual with sensitive or confidential information, and may speak too freely to others.
Discretion;D;Too talkative about matters that are confidential or sensitive, but has not given away secrets that could cause damage.
Discretion;E;Does not understand the importance of confidentiality and has given away private or sensitive information that can potentially damage a business or an individual.
Response to criticism;A;Accepts criticism cheerfully, and uses criticism productively to develop own abilities and skills.
Response to criticism;B;Takes criticism seriously and tries to learn from it, though can sometimes be a little defensive.
Response to criticism;C;Usually defensive when efforts are criticised - but nevertheless tries to learn from mistakes.
Response to criticism;D;Always defensive when others criticize - but nevertheless tries to learn from mistakes.
Response to criticism;E;Resentful when others criticize.  Does not learn from criticism and carries on behaving exactly as before.
Judgement;A;Applies professional experience and/or knowledge of people expertly to forecast outcomes with at least 90% accuracy. Others trust this person's judgement because the choices have usually been good.
Judgement;B;Applies professional experience and/or knowledge of people well to forecast outcomes with at least 75% accuracy.
Judgement;C;Applies professional experience and/or knowledge of people reasonably well to forecast outcomes with at least 60% accuracy.
Judgement;D;Forecasts are more usually wrong than right because this person judges people poorly and fails to apply professional experience.
Judgement;E;Is unable to apply professional experience and/or knowledge of people to forecast outcomes with any degree of accuracy. Forecasts are correct less than 30% of the time.
Organization;A;Prioritizes and sequences own tasks and those of other people in the team.  Makes sure that the priority tasks are always completed on time.
Organization;B;Good at organizing own work and usually finishes priority tasks on time, but there's less evidence of organizing the work of the team. 
Organization;C;Does the right things at the right time when instructed. But without instruction, sometimes fails to spot the priorities and sometimes completes work late.
Organization;D;Needs lots of help to organize work. and even then sometimes focuses on the wrong thing, and frequently completes work late.
Organization;E;Always carries out duties haphazardly, without regard to priority or sequence.  Often found to be spending too long on the wrong thing, and frequently completes assignments late.
Crisis management;A;Reacts quickly and decisively in an emergency, keeping a cool head and effectively leading others.
Crisis management;B;Is a good team member in an emergency, following instructions quickly, but not taking a leadership role.
Crisis management;C;Stays cool in an emergency, but needs help from others to take the right action quickly.
Crisis management;D;Fails to react quickly enough in an emergency, but doesn't usually panic.
Crisis management;E;Panics and gets flustered when an emergency arises.
Accuracy;A;Pays great attention to detail, and has always presented work properly checked and completely free of error.
Accuracy;B;Generally good with detail and checks work thoroughly, but there have been one or two minor errors in work presented in the current period, not putting the business at risk.
Accuracy;C;One or two minor errors have been spotted in work presented in the current period, not putting the business at risk, but which could have been prevented if the facts and figures had been properly checked.
Accuracy;D;Regular errors have been discovered in work presented in the current period.  While the consequences are not serious, much more attention to detail is required.
Accuracy;E;In the current period, slipshod work has been presented with serious inaccuracies, putting the business at risk.
Courage;A;Is willing to face physical risks and danger, and appears to do so without fear. Sets an example of bravery that inspires others.
Courage;B;May not always appear to be the bravest, but is nevertheless ready to take on tasks that involve physical risk and danger.
Courage;C;Somewhat nervous about taking on tasks that involve physical risk and danger, but prepared to participate provided others do too.
Courage;D;Reluctant to do anything that might involve physical risk or danger. 
Courage;E;Refuses to do anything that might involve physical risk or danger - and sees danger at every turn.
Determination;A;Responds to setbacks or adversity with redoubled vigour and enthusiasm. Will never accept that defeat is a foregone conclusion, and inspires others to stay positive and fight on.
Determination;B;In the face of setbacks or adversity will continue to pursue the objective, and doesn't give up. But may not be able to inspire others to continue as well.
Determination;C;In the face of setbacks or adversity will wait to see how others respond before continuing. Will continue to pursue the objective as long as others lead the way. but will give up otherwise.
Determination;D;When there are setbacks or adversity, will soon start to question the objectives and will only continue the challenge after persuasion and reassurance from a leader.
Determination;E;Gives up and accepts defeat after even a minor setback. Lowers the morale of all around.
Enthusiasm;A;Always eager to take on a new task, whether hard or simple, and tackles it diligently, without question or complaint. This positive attitude inspires others too.
Enthusiasm;B;Usually eager to work, but on one or two occasions has been less than willing to tackle an assignment within the range of competence, or reluctant to learn something new. 
Enthusiasm;C;Generally takes on tasks or assignments without objection, but does not appear to be strongly motivated, and will not inspire others.
Enthusiasm;D;Has often questioned the validity of tasks or assignments within the range of competence, or has carried them out with obvious reluctance.
Enthusiasm;E;Responds badly to instructions and will not carry out a task or assignment unless it is demanded. Likely to demotivate others.
Communication;A;Always succeeds in explaining ideas clearly. Others find this person easy to understand. Also has the ability to listen carefully to what others are saying, to understand and then to respond appropriately. Conversations with this person are two-way.
Communication;B;Has the potential to be a good communicator, although may occasionally confuse some listeners. Gives others the chance to speak too, and seems to take on board their point of view.
Communication;C;Communicates reasonably well, but not someone you would choose to present a case effectively or to get across detailed instructions. Generally seems to listen to others and take on board their views.
Communication;D;Not a comfortable communicator.  Either somewhat reticent, or talks too much and has one-way conversations.
Communication;E;Doesn't put across ideas well.  Either doesn't make an impression at all, or others find explanations confusing. Also takes no notice whatsoever of the contributions of others.
Literacy;A;Has a flair for creative, original writing and makes an impact on the reader. Can adapt the style to the purpose.  Never makes mistakes with grammar, spelling or style.
Literacy;B;A competent writer, who reliably produces professional business correspondence and reports free of spelling, grammar and structural mistakes.
Literacy;C;With a supervisor checking for occasional spelling, grammar and style errors, can produce business correspondence and reports of acceptable quality.
Literacy;D;Writes well enough to produce internal reports and correspondence, but makes too many mistakes to write to customers or external business contacts.
Literacy;E;A poor writer, unable to write coherent business reports or correspondence, even for internal use.
Negotiation;A;Silver-tongued, and usually successful when trying to persuade others to move from their original position towards or beyond compromise. Using personality, logic, persistence, always manages to get the best deal.
Negotiation;B;Always looking for the opportunity to negotiate and often successful in getting a good deal. But sometimes fails to press home the advantage, and doesn't get the best deal possible.
Negotiation;C;Sometimes needs to be reminded to negotiate, but then does so reasonably well, and sometimes manages to get others to change their position and get a good deal.
Negotiation;D;Usually forgets to negotiate and accepts the other party's position. Has had occasional success in getting a good deal.
Negotiation;E;Hates negotiation, and leaves it up to others to fight for the best deal.
Presentation skills;A;Enjoys public speaking, and is very well received by audiences. Eloquent, clear, persuasive, interesting, always captures the interest and fires the imagination of listeners. Comfortable in any situation, even when speaking unprepared and without notes.
Presentation skills;B;A persuasive, engaging speaker when well-prepared, but uncomfortable and less effective when asked to speak off-the-cuff.
Presentation skills;C;Can hold and engage an audience, but not convincing or persuasive enough to be used as a keynote speaker/presenter.
Presentation skills;D;Struggles with public speaking. Not fluent or persuasive, and finds it difficult to hold the interest of an audience, who have a lukewarm response.
Presentation skills;E;Completely unsuited for public speaking. Nervous, loses track of topic, unstructured, fails to engage with audience.
